sentence,stance,topic
"Gene editing can lead to breakthroughs in medicine, allowing for the development of personalized treatments for genetic conditions",con,Gene editing should be banned
"Gene editing can prevent the inheritance of genetic diseases, reducing the overall burden on healthcare systems",con,Gene editing should be banned
"Gene editing could be used to enhance human intelligence and physical capabilities, improving the human race as a whole",con,Gene editing should be banned
Gene editing allows for scientific advancements that can help us understand the human genome and treat previously untreatable diseases,con,Gene editing should be banned
"Gene editing could provide solutions to problems like aging and organ transplant rejection, offering significant benefits for society",con,Gene editing should be banned
"Working from home offers more flexibility, which allows employees to manage their time and workload more effectively",pro,Working at home is more productive than working in office
"At home, employees are less likely to be distracted by office politics, which increases their focus and productivity",pro,Working at home is more productive than working in office
"Employees working from home experience a better work-life balance, leading to less burnout and higher productivity",pro,Working at home is more productive than working in office
"Remote work eliminates commuting time, allowing employees to dedicate more time to work or personal activities",pro,Working at home is more productive than working in office
"Remote workers can create personalized work environments that suit their needs, boosting efficiency and comfort",pro,Working at home is more productive than working in office
"Working from home can reduce stress by allowing employees to work in a familiar, comfortable setting",pro,Working at home is more productive than working in office
"Remote work allows for a more diverse workforce, as employees are no longer restricted by geographic location",pro,Working at home is more productive than working in office
"Home offices tend to be quieter and more controlled, leading to fewer interruptions and greater focus",pro,Working at home is more productive than working in office
"Employees can use the time saved from commuting for additional work tasks, increasing overall productivity",pro,Working at home is more productive than working in office
"Remote work reduces office-related distractions like meetings and social interactions, allowing employees to focus on tasks",pro,Working at home is more productive than working in office
"Working in an office provides a structured environment, which helps some people stay on task and be more productive",con,Working at home is more productive than working in office
"Office environments foster collaboration and spontaneous problem-solving, which can boost productivity",con,Working at home is more productive than working in office
"Working in the office allows for clear boundaries between work and personal life, reducing potential distractions",con,Working at home is more productive than working in office
"Employees in the office have immediate access to supervisors and colleagues, which can improve communication and problem-solving",con,Working at home is more productive than working in office
"Working in the office helps build team cohesion and collaboration, which can lead to more productive outcomes",con,Working at home is more productive than working in office
"Office work provides employees with access to resources, equipment, and support that may not be available at home",con,Working at home is more productive than working in office
"Working from home may cause feelings of isolation, which can negatively affect motivation and productivity",con,Working at home is more productive than working in office
"Being in the office helps employees separate personal and work responsibilities, leading to better focus during work hours",con,Working at home is more productive than working in office
"In-office work provides a clear start and end to the workday, which helps employees maintain a consistent routine",con,Working at home is more productive than working in office
"Remote work may lack structure, leading to procrastination and decreased overall productivity for some employees",con,Working at home is more productive than working in office
The government should regulate people with extraordinary strength to prevent potential harm to others,pro,"The government should control people who are stronger than others, who might potentially be dangerous"
"People with superior strength may pose a risk to public safety, and the government should ensure they are properly monitored",pro,"The government should control people who are stronger than others, who might potentially be dangerous"
"Individuals with enhanced physical abilities could misuse their strength, and the government should intervene to ensure public security",pro,"The government should control people who are stronger than others, who might potentially be dangerous"
"Stronger individuals might have an unfair advantage over others, creating social and economic imbalances that the government should address",pro,"The government should control people who are stronger than others, who might potentially be dangerous"
"Without government regulation, people with extraordinary strength could be a threat to others in situations of anger or conflict",pro,"The government should control people who are stronger than others, who might potentially be dangerous"
The government should implement policies that help people with extreme strength control their abilities and ensure they don't harm others,pro,"The government should control people who are stronger than others, who might potentially be dangerous"
"Greater physical strength could lead to a person becoming overly aggressive, and the government should regulate it to prevent violence",pro,"The government should control people who are stronger than others, who might potentially be dangerous"
"Physical power should be monitored by the government, much like how dangerous weapons are regulated, to ensure public safety",pro,"The government should control people who are stronger than others, who might potentially be dangerous"
The government should require people with extreme physical strength to undergo psychological evaluations to prevent violent outbursts,pro,"The government should control people who are stronger than others, who might potentially be dangerous"
"Extreme strength could be used for criminal activities like robbery or assault, and government control is needed to prevent abuse of power",pro,"The government should control people who are stronger than others, who might potentially be dangerous"
"People with extreme strength have the potential to protect others, not just harm them, and the government should focus on positive use of their abilities",con,"The government should control people who are stronger than others, who might potentially be dangerous"
"Strong individuals are not inherently dangerous, and the government should not discriminate based on physical ability",con,"The government should control people who are stronger than others, who might potentially be dangerous"
"The government already regulates dangerous behavior through laws against assault and violence, making additional control over strength unnecessary",con,"The government should control people who are stronger than others, who might potentially be dangerous"
Strong individuals should be responsible for managing their abilities and should not be treated as potential threats without evidence of wrongdoing,con,"The government should control people who are stronger than others, who might potentially be dangerous"
"Influencers have too much power over their followers, and their influence in politics could be dangerous if they lack the necessary expertise",pro,Influencers should not be allowed to take position in political power
"Many influencers prioritize profit and personal gain over public welfare, making them unsuitable for political leadership",pro,Influencers should not be allowed to take position in political power
"Influencers have a responsibility to promote brands and products, not govern or make decisions that affect people's lives",pro,Influencers should not be allowed to take position in political power
"Influencers are often not trained in politics or governance, and giving them political power could undermine democratic processes",pro,Influencers should not be allowed to take position in political power
"Social media platforms give influencers the ability to manipulate public opinion, and placing them in political power could lead to conflicts of interest",pro,Influencers should not be allowed to take position in political power
"Influencers may be swayed by financial or personal interests, making them unfit to represent the public or make unbiased political decisions",pro,Influencers should not be allowed to take position in political power
"Influencers have large followings based on their personal brands, not because of political knowledge or competence",pro,Influencers should not be allowed to take position in political power
"Influencers could use their political position to promote their own products or agendas, leading to corruption and a lack of accountability",pro,Influencers should not be allowed to take position in political power
Allowing influencers to hold political power could undermine the credibility of democratic institutions and foster distrust in the political system,pro,Influencers should not be allowed to take position in political power
"Political leadership requires experience, education, and critical thinking skills, which many influencers may lack",pro,Influencers should not be allowed to take position in political power
"Influencers often use their platform to spread divisive opinions, and having them in political power could exacerbate polarization and harm social cohesion",con,Influencers should not be allowed to take position in political power
"Influencers have the power to raise awareness on critical issues, and they could use that platform for positive political change",con,Influencers should not be allowed to take position in political power
"Influencers can connect with younger and diverse audiences, making them valuable in representing groups that are often underrepresented in politics",con,Influencers should not be allowed to take position in political power
Some influencers have the knowledge and expertise in certain fields that could bring fresh perspectives to political decision-making,con,Influencers should not be allowed to take position in political power
"Influencers are often perceived as more relatable and trustworthy by the public, which could help bridge the gap between politicians and voters",con,Influencers should not be allowed to take position in political power
"Influencers have the ability to inspire change and motivate people to take action, which can be a valuable trait in political leadership",con,Influencers should not be allowed to take position in political power
"With proper training, influencers could bring a new, modern approach to politics and help revitalize political engagement among younger generations",con,Influencers should not be allowed to take position in political power
"Influencers are skilled at communication, which is crucial for effective leadership and gaining public support in politics",con,Influencers should not be allowed to take position in political power
"Influencers have been successful at building trust and loyalty, qualities that could serve them well in a political role",con,Influencers should not be allowed to take position in political power
"K-Drama romance plots often follow unrealistic tropes that fail to reflect real-life relationships, which can lead to unrealistic expectations among viewers",pro,K drama romance plots and characters should be more realistic and less stereotypical
"Many K-Drama characters, especially female leads, are overly idealized and reinforce outdated gender stereotypes",pro,K drama romance plots and characters should be more realistic and less stereotypical
"The overuse of certain plot devices, like love triangles or the 'rich CEO and poor girl' trope, makes K-Drama romances feel predictable and formulaic",pro,K drama romance plots and characters should be more realistic and less stereotypical
Unrealistic portrayals of romance in K-Dramas can give young viewers distorted views of love and relationships,pro,K drama romance plots and characters should be more realistic and less stereotypical
Realistic depictions of romance and characters in K-Dramas would promote healthier and more relatable portrayals of love,pro,K drama romance plots and characters should be more realistic and less stereotypical
"K-Drama characters are often too one-dimensional, which undermines the emotional depth and complexity that real relationships possess",pro,K drama romance plots and characters should be more realistic and less stereotypical
"More realistic characters in K-Dramas could reflect the diversity of real-world relationships, making them more relatable to a global audience",pro,K drama romance plots and characters should be more realistic and less stereotypical
Excessive emphasis on 'perfect' love stories in K-Dramas can perpetuate unhealthy relationship ideals and affect viewers' self-esteem,pro,K drama romance plots and characters should be more realistic and less stereotypical
"By showcasing more realistic characters and relationships, K-Dramas could break free from the rigid, traditional gender roles that dominate the genre",pro,K drama romance plots and characters should be more realistic and less stereotypical
More diverse and complex romance plots in K-Dramas would challenge cultural norms and push for a more progressive view of love,pro,K drama romance plots and characters should be more realistic and less stereotypical
K-Drama romances should focus on deep emotional connections rather than superficial tropes to reflect the complexity of real love,con,K drama romance plots and characters should be more realistic and less stereotypical
"K-Drama romance plots are meant to be idealized and entertaining, not necessarily realistic, which is what attracts many viewers",con,K drama romance plots and characters should be more realistic and less stereotypical
"Unrealistic romantic plots are part of the charm and escapism that many viewers enjoy, and making them more realistic could diminish the fantasy aspect",con,K drama romance plots and characters should be more realistic and less stereotypical
"Romanticized portrayals of love in K-Dramas allow people to dream about perfect relationships, which is why they are so popular",con,K drama romance plots and characters should be more realistic and less stereotypical
"Romantic tropes in K-Dramas reflect the idealized version of love, which is important for storytelling and emotional engagement",con,K drama romance plots and characters should be more realistic and less stereotypical
"Exaggerated characters and plots in K-Dramas are part of the genre's unique charm, and shifting towards realism could make them feel less captivating",con,K drama romance plots and characters should be more realistic and less stereotypical
"Realism in K-Drama romances could undermine the genre��s cultural value, which often reflects society's traditional views on relationships",con,K drama romance plots and characters should be more realistic and less stereotypical
"K-Drama is an escape from the mundane, and viewers enjoy idealized characters and plots as a form of fantasy, not as a mirror of reality",con,K drama romance plots and characters should be more realistic and less stereotypical
"Many K-Drama fans enjoy the stylized, exaggerated forms of romance because they provide entertainment, not lessons in real-life relationships",con,K drama romance plots and characters should be more realistic and less stereotypical
The overuse of unrealistic tropes in K-Dramas does not harm viewers as long as it is understood to be fictional entertainment,con,K drama romance plots and characters should be more realistic and less stereotypical
"Doctors have an ethical obligation to be honest with terminally ill patients, as transparency is crucial for informed decision-making",pro,Doctors have an obligation to tell the truth to terminally ill patients
Being honest with terminally ill patients respects their autonomy and allows them to make end-of-life decisions according to their own values,pro,Doctors have an obligation to tell the truth to terminally ill patients
"Honesty from doctors allows terminally ill patients to prepare emotionally, spiritually, and practically for their final days",pro,Doctors have an obligation to tell the truth to terminally ill patients
"Transparency in diagnosis and prognosis helps patients seek support from family, friends, and counselors, which can improve quality of life",pro,Doctors have an obligation to tell the truth to terminally ill patients
Terminally ill patients have the right to know the truth about their condition in order to plan their affairs and make peace with their situation,pro,Doctors have an obligation to tell the truth to terminally ill patients
Telling the truth about a terminal diagnosis allows patients to access palliative care and other treatments that can improve their remaining time,pro,Doctors have an obligation to tell the truth to terminally ill patients
"Honesty in medicine helps build trust between doctors and patients, which is essential for effective healthcare",pro,Doctors have an obligation to tell the truth to terminally ill patients
Patients who are not told the truth about their terminal condition may experience greater emotional distress when the reality sets in,pro,Doctors have an obligation to tell the truth to terminally ill patients
Truthful communication can help terminally ill patients make decisions about their final days and prepare their families for the future,pro,Doctors have an obligation to tell the truth to terminally ill patients
"By being honest, doctors empower patients to live their final days with dignity, making informed choices about their care",pro,Doctors have an obligation to tell the truth to terminally ill patients
Doctors should avoid causing unnecessary distress by telling terminally ill patients the harsh truth when it is not essential,con,Doctors have an obligation to tell the truth to terminally ill patients
Telling terminally ill patients the truth about their prognosis could lead to increased anxiety and worsen their quality of life,con,Doctors have an obligation to tell the truth to terminally ill patients
"Sometimes, a more gentle approach is appropriate, and doctors should prioritize emotional well-being over blunt honesty",con,Doctors have an obligation to tell the truth to terminally ill patients
"Terminally ill patients may not want to know the full truth, and doctors should respect their desire for peace and hope",con,Doctors have an obligation to tell the truth to terminally ill patients
"In certain cases, doctors may choose not to fully disclose the truth to prevent unnecessary distress or emotional suffering",con,Doctors have an obligation to tell the truth to terminally ill patients
"Not all terminally ill patients are psychologically prepared to hear the truth, and doctors should use discretion in how they communicate",con,Doctors have an obligation to tell the truth to terminally ill patients
The emotional harm caused by telling terminally ill patients the entire truth could outweigh the benefits of full transparency,con,Doctors have an obligation to tell the truth to terminally ill patients
"Terminally ill patients may prefer to live in hope and denial, and doctors should honor their wishes by not focusing solely on the prognosis",con,Doctors have an obligation to tell the truth to terminally ill patients
Doctors should prioritize the well-being of their patients and may choose to withhold information that could lead to unnecessary suffering,con,Doctors have an obligation to tell the truth to terminally ill patients
"Sometimes, telling the truth could undermine the patient's hope and willingness to fight, which could negatively affect their quality of life",con,Doctors have an obligation to tell the truth to terminally ill patients
Raising the minimum wage would help reduce poverty and increase the standard of living for low-income workers,pro,Minimum wage should be raised
"Increasing the minimum wage would allow workers to afford basic necessities like housing, healthcare, and education",pro,Minimum wage should be raised
Raising the minimum wage would stimulate the economy by increasing the purchasing power of workers,pro,Minimum wage should be raised
A higher minimum wage would reduce reliance on social welfare programs by enabling workers to support themselves,pro,Minimum wage should be raised
"Raising the minimum wage would improve workers' morale, leading to increased productivity and reduced turnover",pro,Minimum wage should be raised
"A higher minimum wage ensures fairer compensation for workers who perform essential jobs, such as in retail and food service",pro,Minimum wage should be raised
Raising the minimum wage would reduce income inequality and help close the wealth gap between rich and poor,pro,Minimum wage should be raised
"Increasing the minimum wage would lead to higher consumer spending, which boosts demand for goods and services",pro,Minimum wage should be raised
"Raising the minimum wage would decrease the number of people working multiple jobs to make ends meet, allowing for better work-life balance",pro,Minimum wage should be raised
Raising the minimum wage would promote fairness and ensure that workers are compensated fairly for their labor,con,Minimum wage should be raised
"Raising the minimum wage could lead to job losses, as businesses may be forced to cut positions to manage higher labor costs",con,Minimum wage should be raised
"Increasing the minimum wage may result in higher prices for goods and services, causing inflation",con,Minimum wage should be raised
"Raising the minimum wage could discourage businesses from hiring low-skilled workers, limiting job opportunities for young and inexperienced individuals",con,Minimum wage should be raised
"A higher minimum wage could harm small businesses, who may struggle to afford the increased labor costs",con,Minimum wage should be raised
"Raising the minimum wage may disproportionately affect industries that rely on low-wage labor, such as hospitality and retail",con,Minimum wage should be raised
"Instead of raising the minimum wage, the government should focus on providing better training and educational opportunities for low-income workers",con,Minimum wage should be raised
"Raising the minimum wage could lead to automation in some industries, resulting in job displacement for workers",con,Minimum wage should be raised
"Some businesses may reduce employee benefits or hours in response to a minimum wage increase, negating the benefits of the raise",con,Minimum wage should be raised
Increasing the minimum wage may not effectively reduce poverty if it leads to higher unemployment rates and fewer job opportunities,con,Minimum wage should be raised
