sentence,stance,topic
Sea exploration is essential for understanding the ecosystems of our planet and protecting marine biodiversity,pro,Sea exploration is more important than space exploration
"Oceans cover over 70% of the Earth's surface, and exploring them could yield valuable scientific discoveries",pro,Sea exploration is more important than space exploration
"Unlike space exploration, sea exploration has immediate practical applications for climate change and ocean health",pro,Sea exploration is more important than space exploration
The oceans hold untapped resources that could provide solutions for the world��s growing energy and food needs,pro,Sea exploration is more important than space exploration
Understanding ocean currents and marine life is critical for mitigating natural disasters like tsunamis and hurricanes,pro,Sea exploration is more important than space exploration
"Space exploration opens up possibilities for discovering new habitable planets, which is crucial for humanity's long-term survival",con,Sea exploration is more important than space exploration
"Space exploration offers a much broader understanding of the universe, including potential life beyond Earth",con,Sea exploration is more important than space exploration
"Investing in space exploration has led to technological advancements that benefit society, such as satellite technology",con,Sea exploration is more important than space exploration
"The challenges and innovations involved in space exploration could inspire scientific breakthroughs in other fields, including medicine and energy",con,Sea exploration is more important than space exploration
"Space is a new frontier that holds the potential for future colonization, while we have already mapped much of the ocean floor",con,Sea exploration is more important than space exploration
"AI in the classroom can be biased if not properly regulated, leading to unfair treatment of students",pro,AI should be regulated in the classroom
"Without regulation, AI could replace teachers, undermining the importance of human interaction in education",pro,AI should be regulated in the classroom
"AI systems can be vulnerable to data breaches, which can compromise students' personal and academic information",pro,AI should be regulated in the classroom
"AI could reinforce existing inequalities if not regulated, particularly in low-income or underprivileged schools",pro,AI should be regulated in the classroom
"Regulating AI in the classroom would ensure it is used ethically and in ways that enhance, rather than replace, human learning",pro,AI should be regulated in the classroom
AI has the potential to greatly enhance personalized learning and should be allowed to operate freely in classrooms,con,AI should be regulated in the classroom
"Regulation could limit the innovative uses of AI, preventing students from benefiting from cutting-edge technologies",con,AI should be regulated in the classroom
"AI can assist teachers by automating administrative tasks, allowing them to focus more on student engagement and teaching",con,AI should be regulated in the classroom
"Unregulated AI could help students in ways traditional teaching methods cannot, improving education outcomes overall",con,AI should be regulated in the classroom
"Rather than over-regulating AI, we should focus on educating students and teachers on how to effectively use these technologies",con,AI should be regulated in the classroom
"Shopping in physical stores allows consumers to try products before purchasing, ensuring better satisfaction",pro,Physical shops are a better choice than online shops
Physical shops provide immediate access to products without the need to wait for delivery,pro,Physical shops are a better choice than online shops
The in-store shopping experience supports local businesses and contributes to the economy,pro,Physical shops are a better choice than online shops
"Physical stores offer personalized customer service, which can improve the shopping experience",pro,Physical shops are a better choice than online shops
Shopping in person allows customers to interact with products directly and make more informed purchasing decisions,pro,Physical shops are a better choice than online shops
Online shopping provides greater convenience and allows people to shop from the comfort of their own homes,con,Physical shops are a better choice than online shops
"Physical stores require customers to travel, leading to wasted time and energy, whereas online shopping is available 24/7",con,Physical shops are a better choice than online shops
"Online shops offer a wider variety of products, often at lower prices, due to the lack of overhead costs",con,Physical shops are a better choice than online shops
"With online reviews, price comparisons, and easy returns, online shopping provides a more flexible and informed shopping experience",con,Physical shops are a better choice than online shops
Online shopping has minimal environmental impact compared to the resources required for maintaining physical stores,con,Physical shops are a better choice than online shops
The oceans are largely unexplored and hold untapped potential for scientific discovery,pro,Sea exploration is more important than space exploration
"Exploring the seas can provide crucial information to combat climate change, such as understanding carbon sequestration in marine environments",pro,Sea exploration is more important than space exploration
"Marine biodiversity is essential for global food security, and understanding it requires further exploration",pro,Sea exploration is more important than space exploration
Ocean exploration is a more immediate solution for environmental crises like overfishing and pollution,pro,Sea exploration is more important than space exploration
"The oceans provide a source of natural resources like oil, gas, and minerals that could be crucial for future energy demands",pro,Sea exploration is more important than space exploration
Space exploration is essential for the long-term survival of humanity as it offers potential solutions to overpopulation and resource depletion on Earth,con,Sea exploration is more important than space exploration
"Space exploration provides insight into the origins of the universe and the possibility of life beyond Earth, a fundamental scientific endeavor",con,Sea exploration is more important than space exploration
"Technological advancements from space exploration, such as satellite communications, have had a profound impact on society",con,Sea exploration is more important than space exploration
"Space missions, like those aimed at Mars, could provide a backup plan for humanity in case of catastrophic Earth events, such as an asteroid impact",con,Sea exploration is more important than space exploration
"Space is a new frontier that holds the potential for future colonization, while we have already mapped much of the ocean floor",con,Sea exploration is more important than space exploration
"AI in the classroom can be biased if not properly regulated, leading to unfair treatment of students",pro,AI should be regulated in the classroom
"Without regulation, AI could replace teachers, undermining the importance of human interaction in education",pro,AI should be regulated in the classroom
"AI systems can be vulnerable to data breaches, which can compromise students' personal and academic information",pro,AI should be regulated in the classroom
"AI could reinforce existing inequalities if not regulated, particularly in low-income or underprivileged schools",pro,AI should be regulated in the classroom
"Regulating AI in the classroom would ensure it is used ethically and in ways that enhance, rather than replace, human learning",pro,AI should be regulated in the classroom
AI has the potential to greatly enhance personalized learning and should be allowed to operate freely in classrooms,con,AI should be regulated in the classroom
"Regulation could limit the innovative uses of AI, preventing students from benefiting from cutting-edge technologies",con,AI should be regulated in the classroom
"AI can assist teachers by automating administrative tasks, allowing them to focus more on student engagement and teaching",con,AI should be regulated in the classroom
"Unregulated AI could help students in ways traditional teaching methods cannot, improving education outcomes overall",con,AI should be regulated in the classroom
"Rather than over-regulating AI, we should focus on educating students and teachers on how to effectively use these technologies",con,AI should be regulated in the classroom
"Shopping in physical stores allows consumers to try on clothes and test products before purchase, which can prevent dissatisfaction",pro,Physical shops are a better choice than online shops
Physical shops offer immediate access to products without the need to wait for delivery,pro,Physical shops are a better choice than online shops
"In-person shopping supports local businesses, benefiting the community and contributing to the local economy",pro,Physical shops are a better choice than online shops
"Physical stores offer personalized customer service, which can improve the shopping experience",pro,Physical shops are a better choice than online shops
Shopping in person allows customers to interact with products directly and make more informed purchasing decisions,pro,Physical shops are a better choice than online shops
Online shopping provides greater convenience and allows people to shop from the comfort of their own homes,con,Physical shops are a better choice than online shops
"Physical stores require customers to travel, leading to wasted time and energy, whereas online shopping is available 24/7",con,Physical shops are a better choice than online shops
"Online shops offer a wider variety of products, often at lower prices, due to the lack of overhead costs",con,Physical shops are a better choice than online shops
"With online reviews, price comparisons, and easy returns, online shopping provides a more flexible and informed shopping experience",con,Physical shops are a better choice than online shops
Online shopping has minimal environmental impact compared to the resources required for maintaining physical stores,con,Physical shops are a better choice than online shops
"Universal Basic Income provides financial security for all, reducing poverty and economic inequality",pro,Universal Basic Income (UBI) is a good idea
"A guaranteed income allows people to pursue education, entrepreneurship, or other opportunities without the pressure of financial instability",pro,Universal Basic Income (UBI) is a good idea
"UBI can help people transition to the gig economy, where job security is less certain, by providing a stable base income",pro,Universal Basic Income (UBI) is a good idea
"With automation replacing jobs, UBI is an essential safety net for workers displaced by technology",pro,Universal Basic Income (UBI) is a good idea
UBI can improve mental health and well-being by reducing stress and anxiety related to financial insecurity,pro,Universal Basic Income (UBI) is a good idea
"UBI could lead to a decrease in the incentive to work, as people might rely on the guaranteed income instead of seeking employment",con,Universal Basic Income (UBI) is a good idea
"Funding UBI would require significant government spending, possibly leading to higher taxes or cuts in other public services",con,Universal Basic Income (UBI) is a good idea
"Universal Basic Income might not be effective in addressing the root causes of poverty, such as lack of education and access to healthcare",con,Universal Basic Income (UBI) is a good idea
"UBI could lead to inflation, reducing the value of the income provided and ultimately not improving quality of life",con,Universal Basic Income (UBI) is a good idea
"The implementation of UBI might result in less targeted support for the most vulnerable, such as those with disabilities or specific healthcare needs",con,Universal Basic Income (UBI) is a good idea
"Fossil fuels are a major driver of climate change, and their use should be phased out to protect the planet",pro,The use of fossil fuels should be banned
Switching to renewable energy sources such as wind and solar can create new jobs and boost the green economy,pro,The use of fossil fuels should be banned
"Reducing reliance on fossil fuels will help reduce air and water pollution, improving public health",pro,The use of fossil fuels should be banned
"Fossil fuels are finite resources, and moving away from them will ensure long-term energy security",pro,The use of fossil fuels should be banned
"Banning fossil fuels will accelerate innovation in clean energy technologies, which is necessary to mitigate climate change",pro,The use of fossil fuels should be banned
"Fossil fuels are currently the most reliable and affordable source of energy, and banning them could disrupt economies",con,The use of fossil fuels should be banned
"Many countries depend on fossil fuels for economic development, and a sudden ban would cause social and economic instability",con,The use of fossil fuels should be banned
Renewable energy technologies are still in development and may not be able to meet global energy demands in the short term,con,The use of fossil fuels should be banned
A ban on fossil fuels could lead to significant job losses in industries such as coal mining and oil drilling,con,The use of fossil fuels should be banned
A more practical solution would be to reduce fossil fuel consumption gradually while investing in cleaner technologies,con,The use of fossil fuels should be banned
Social media is a significant contributor to the rise in anxiety and depression among teenagers,pro,Social Media does more harm than good
"Studies have shown a correlation between heavy social media use and poor mental health outcomes, especially in young people",pro,Social Media does more harm than good
"Social media platforms are designed to keep users hooked, often leading to addictive behaviors and reduced productivity",pro,Social Media does more harm than good
"Social media can create unrealistic standards of beauty, success, and happiness, leading to negative self-image",pro,Social Media does more harm than good
"The spread of fake news and misinformation on social media has led to serious consequences, including political instability",pro,Social Media does more harm than good
"Social media has replaced real-life interaction, making people feel more isolated despite being 'connected' online",pro,Social Media does more harm than good
"Social media has been linked to the rise in cyberbullying, which negatively affects the mental health of vulnerable individuals",pro,Social Media does more harm than good
"Social media platforms are often used to manipulate public opinion and spread propaganda, influencing elections and social movements",pro,Social Media does more harm than good
Spending too much time on social media can lead to a lack of real-world social skills and a weakened ability to form genuine relationships,pro,Social Media does more harm than good
"Social media companies profit from user data and engagement, often prioritizing profit over the well-being of their users",pro,Social Media does more harm than good
"Social media helps people stay in touch with family and friends, regardless of geographic distance",con,Social Media does more harm than good
"Through social media, people can join global communities and find support for a variety of causes and personal challenges",con,Social Media does more harm than good
"Social media has been instrumental in organizing social movements, allowing people to voice their opinions and advocate for change",con,Social Media does more harm than good
Social media can help people stay informed about current events and global news in real-time,con,Social Media does more harm than good
Online platforms give people the opportunity to learn new skills and knowledge through educational content,con,Social Media does more harm than good
"Social media fosters global connections, allowing users to communicate with people from different cultures and backgrounds",con,Social Media does more harm than good
Social media provides businesses with a powerful marketing tool that can help reach a wider audience and grow their brand,con,Social Media does more harm than good
"Through social media, people can access and share information quickly, which can help in emergencies and crisis situations",con,Social Media does more harm than good
Social media platforms allow for free expression and the sharing of diverse ideas and perspectives,con,Social Media does more harm than good
Social media platforms can provide a sense of community and belonging for individuals who might otherwise feel marginalized,con,Social Media does more harm than good
"Climate change is causing an increase in the frequency and intensity of extreme weather events, threatening human lives and infrastructure",pro,Climate change is the greatest threat to humanity
Rising sea levels caused by climate change could displace millions of people and lead to widespread loss of land and property,pro,Climate change is the greatest threat to humanity
The loss of biodiversity due to climate change is having a devastating impact on ecosystems and threatens the survival of many species,pro,Climate change is the greatest threat to humanity
"Climate change poses a threat to global food security, as changes in weather patterns affect crop yields and food distribution",pro,Climate change is the greatest threat to humanity
"Extreme weather events like floods, hurricanes, and wildfires, which are exacerbated by climate change, are becoming more frequent and deadly",pro,Climate change is the greatest threat to humanity
"Climate change contributes to the spread of diseases, as warmer temperatures allow pathogens and mosquitoes to thrive in new regions",pro,Climate change is the greatest threat to humanity
"Polar ice caps are melting at alarming rates, contributing to rising sea levels and the destruction of polar ecosystems",pro,Climate change is the greatest threat to humanity
"Climate change is threatening fresh water sources due to droughts and altered precipitation patterns, affecting billions of people",pro,Climate change is the greatest threat to humanity
"Deforestation, driven by climate change and human activity, is contributing to the acceleration of climate change and the loss of biodiversity",pro,Climate change is the greatest threat to humanity
"Climate change impacts the most vulnerable populations disproportionately, leading to increased poverty and social inequality",pro,Climate change is the greatest threat to humanity
"Other issues like poverty and political instability are more immediate and require urgent attention, while climate change is a long-term issue",con,Climate change is the greatest threat to humanity
"Global health crises like pandemics are a more pressing threat to humanity, as seen with COVID-19",con,Climate change is the greatest threat to humanity
Political instability and conflicts are more likely to destabilize regions and cause more immediate harm than the gradual effects of climate change,con,Climate change is the greatest threat to humanity
"Poverty remains a more pressing issue for many people, and addressing it could help mitigate other global challenges, including climate change",con,Climate change is the greatest threat to humanity
"Climate change models are often based on uncertain data, and the actual impact of climate change might be less severe than predicted",con,Climate change is the greatest threat to humanity
"Focusing on climate change diverts attention from urgent global challenges such as healthcare access, education, and food security",con,Climate change is the greatest threat to humanity
"Climate change is a global issue that cannot be solved without international cooperation, which is often hindered by geopolitical tensions",con,Climate change is the greatest threat to humanity
"Technological innovations, such as renewable energy sources, are already mitigating the effects of climate change, reducing the threat it poses",con,Climate change is the greatest threat to humanity
Population growth and urbanization pose greater threats to humanity than climate change alone,con,Climate change is the greatest threat to humanity
"Climate change can be managed over time through adaptation strategies, whereas other crises like pandemics and political instability are more immediate and unpredictable",con,Climate change is the greatest threat to humanity
"Genetically modified crops can be designed to be more resistant to pests, diseases, and environmental stress, improving food security",pro,Genetic modification of food should be banned
GMOs can help address global food shortages by increasing the yield and nutritional value of crops,pro,Genetic modification of food should be banned
"Genetically modified crops can be engineered to require fewer pesticides, leading to less environmental pollution and harm to wildlife",pro,Genetic modification of food should be banned
"GMOs can be tailored to withstand harsh environmental conditions, ensuring stable food production even in changing climates",pro,Genetic modification of food should be banned
Genetically modified organisms (GMOs) have already been proven safe to eat by numerous scientific studies and regulatory bodies,pro,Genetic modification of food should be banned
GMOs can help alleviate hunger in developing countries by providing crops that are resistant to disease and drought,pro,Genetic modification of food should be banned
"Genetic modification of crops has led to reduced use of herbicides and pesticides, benefiting the environment and farmers",pro,Genetic modification of food should be banned
Genetically modified crops can reduce food waste by extending shelf life and improving transportation efficiency,pro,Genetic modification of food should be banned
"GMOs can help increase food security by reducing dependence on traditional, vulnerable crops that are susceptible to diseases and pests",pro,Genetic modification of food should be banned
GMOs can help make food production more sustainable and reduce the environmental impact of traditional farming practices,pro,Genetic modification of food should be banned
GMOs can lead to the development of superweeds and superbugs that are resistant to the modified crops' properties,con,Genetic modification of food should be banned
"Genetically modified crops could contaminate natural crop varieties, reducing biodiversity and creating environmental risks",con,Genetic modification of food should be banned
"GMOs may have unintended health effects that have not yet been discovered, posing long-term risks to human health",con,Genetic modification of food should be banned
"Genetically modified crops are controlled by large corporations, giving them too much power over food production and pricing",con,Genetic modification of food should be banned
"GMOs could lead to the loss of traditional farming methods and local knowledge, undermining agricultural diversity",con,Genetic modification of food should be banned
"The long-term effects of consuming genetically modified foods are still unknown, and we should exercise caution until more is understood",con,Genetic modification of food should be banned
"GMOs can increase farmers' dependence on seed patents, leading to higher costs and limited access to seeds for poor farmers",con,Genetic modification of food should be banned
"Gene editing can have unintended consequences, leading to irreversible changes in the human genome",pro,Gene editing should be banned
"Gene editing could be used to create 'designer babies,' leading to ethical concerns and social inequality",pro,Gene editing should be banned
"The long-term effects of gene editing on future generations are still unknown, and this uncertainty poses significant risks",pro,Gene editing should be banned
"Gene editing technologies can be misused for eugenics purposes, which is a violation of human rights",pro,Gene editing should be banned
Gene editing could exacerbate social inequality by allowing wealthier families to enhance their children's genetic traits,pro,Gene editing should be banned
Gene editing poses a risk of unintended genetic mutations that could have harmful consequences for individuals or entire populations,pro,Gene editing should be banned
Gene editing is a form of genetic manipulation that could lead to the alteration of human evolution in unpredictable ways,pro,Gene editing should be banned
"Genetic engineering could lead to a lack of genetic diversity in populations, making humans more vulnerable to diseases",pro,Gene editing should be banned
Gene editing should not be allowed because it may lead to the commercialization of human genetic material,pro,Gene editing should be banned
Gene editing could be exploited by powerful corporations or governments to create genetically modified people for specific purposes,pro,Gene editing should be banned
"Gene editing holds the potential to cure genetic diseases, improving the quality of life for countless people",con,Gene editing should be banned
"Gene editing can be used to eliminate genetic disorders such as cystic fibrosis, sickle cell anemia, and Huntington's disease",con,Gene editing should be banned
Gene editing can improve the quality of life by preventing genetic diseases from being passed down to future generations,con,Gene editing should be banned
Gene editing allows for the enhancement of human health and longevity by correcting harmful genetic mutations,con,Gene editing should be banned
"Gene editing offers the opportunity to create more resilient crops and better food sources, which can address global hunger",con,Gene editing should be banned
